id,title,text,created_utc,score,num_comments,subreddit,category
1m63o98,Checking into a ward voluntarily,"**TW: This post contains heavy mentions of suicide and self-harm.**

So for some context, I’m Bipolar (Bipolar I with Mixed Features), but I’m currently waiting for an official diagnosis.

Another thing I’ll say is that I’m not usually the type to self-diagnose... but I grew up in a family with people who *are* diagnosed with

• Bipolar I Disorder
• Schizoaffective Disorder
• MDD, Autism, ADHD, and Anxiety
• Epilepsy

I’m also going to share some background on who I am to build a better picture. Feel free to scroll to the end if needed.

Growing up, I had a chaotic, unstable childhood full of violence, substance abuse, and just straight-up madness.

When I was 6, my brother got sectioned after a suicide attempt. Everyone said, “It was the weed!” or “He’d be fine if he didn’t smoke!” He was a violent criminal, yeah, but to me, he was compassionate. He’d been through so much hell.

My sister (who’s schizoaffective)... watching her downfall was tragic. It happened fast, and it was terrifying. She was someone I *looked up to*. She was working young, making money, laughing, living... but I noticed, even as a kid, that something changed. She became unpredictable and confusing. No one helped her. Everyone just punished her or pushed her away.

She had been struggling mentally for years. I remember being on my DS when suddenly she got super religious out of nowhere. As a 9-year-old, I didn’t think, “This might be psychosis,” but I *knew* something was off. Of course, my family didn’t see anything wrong since religion isn’t inherently bad. But what followed was terrifying. She became violently unwell. I witnessed violence day after day. I can’t excuse what she put me through, but I also don’t understand how it took her getting arrested with a knife before she finally got psychiatric help.

The grief of watching what my siblings *could’ve* been if someone listened still breaks me. I used to internalize beliefs like “weed makes you crazy,” or “why don’t they just act normal?” But looking back...

If my brother was trying to end his life, weed or not, why did nobody *step in*?
How did my sister go around the house doing gun fingers, calling us devils, claiming to be “the chosen one,” and *still* nobody stepped in?

Now me.

I’m 19. Youngest of 9 kids. Mentally, I was just *sensitive*. I felt a lot. Asked a lot of questions. Was the “annoying” little brother always asking “why?” I was into music and drawing. Always isolated.

I was angry, violent, and short-tempered, especially in primary school. At 7, I had weird phobias, weird obsessions, and strange aversions to food. I didn’t eat what other kids ate. I felt like an alien. I’d run away and cry at the sight of cheese. I was super malnourished. Even the foods I *did* like had to be just right. If a chip was too skinny or a crisp too big, I’d lose it.

I *wanted* to eat. I *wanted* to go to school. But I’d have intense reactions. My mum had to take me home sometimes before lessons even started. Eventually, my dad gave up and said, “Fuck this, get this kid checked.” I got prescribed this fruity pink pill. Didn’t do shit and after this every dumb thing I did or every mistake I made was because I was ‘overreacting’ or ‘stupid’.

After that, I just stuck to safe foods. I don’t fear food anymore, but I still have rituals and routines. Still struggled socially. Bullied. Preferred sitting alone drawing.

Things got *slightly* better at 11. I was still freaking out, crying, panicking... but it was more controlled.

But because I was alienated
Because I saw things no one else saw
Because I experienced the *unseeable*
I carried a persistent depression. I didn’t have the guts to label it. Just said, “I’m burned out.”

In my teens, anger quickly became misery. I wasn’t crying over cheese anymore, but there was always a deep, *seething* pain underneath.

From 13 to 17, my family’s chaos hit a peak. Stabbings, violence, constant trauma. I saw it all. But somehow, I just *kept creating*. I doubled my art output. Posted more. Made music. Wrote lyrics. Went outside. Played football. Studied. Won awards. Competed. Got expelled. Got put in detention. Skipped School. Everything under the sun…From 13 to 15, I was *on it*.

Then I started crashing. School performance dropped. I stayed up till 3 a.m. writing YouTube scripts, making music, art... **everything**. Then crashed hard. I got praised for being “productive,” but hustle culture in young people can often just be **hypomania**.

At 15, I had a heartbreak that hit different. Laughed with friends. Cried alone. Felt like I’d conquered the world, then crashed again. Went to Djibouti for a month. I kid you not, I nearly killed myself. Cried every day counted days down. But two weeks later? I was happy again. Left the holiday on a high.

That scared me.

From 15 to 18, my life felt like 2x speed. Made money. Lost it. Dropped out of college. Left two jobs. Up, down. Create, burn out, explode. Repeat.

At 18, I was crashing and burning. Sleeping all day. No basketball. Barely making it through school. Unemployed. Smoking. Drinking. Clubbing. Depressed. Sleeping 14 to 15 hours. Missing interviews. Getting criticized 24/7, even when I did things right. I got hated for things that weren’t even in my control.

Some quotes:
“You’re everything I don’t wanna be.”
“He’s such a crackhead now.”
“He’s a bad influence.”
“He’s so skinny, he must be on everything.”
“At least I don’t smell like weed.”
“Just eat better and fix your sleep.”
“Get used to life as a man,” then grabbed and pushed, told “DON’T BE A BITCH, JUST OPEN UP.”

Once, I was literally in A&E, and instead of “Are you okay?” someone said, “You didn’t send me that £20.”

At that point, I stopped giving a fuck. Life became a video game. I wasn’t even *me*. I was just surviving. Skinny. Numb. Trying to hold onto hope, but even anger stopped motivating me. I thought I was lazy. Truth is, I was just scared to admit I was depressed. But even when I said it out loud, nobody cared.

Then one day (aged 19), I saw my girl. Barely ate. Barely slept. Got home, felt a wave of energy explode inside me. I felt shaky, angry, supercharged. Stared in the mirror. My reflection looked distorted. Bigger. Then I went to the bathroom. I looked handsome? Then stared out the window thinking, “Maybe I found the answer to life. Maybe I don’t need these people.”

Then, BAM, my heart beat out of my chest. Thought I was having a heart attack. Went to ER. Told them I’ve never had panic attacks or sleep issues this bad.

They dismissed me. Again.

After 3 days of no sleep, I passed out for 9 hours. Then stayed up another 2 days. Got sleep paralysis for a second. It scared the fuck out of me. After a week of this, I started feeling decent again. Still missing sleep, but eating, kind of okay. But lights were disgustingly bright. My reflection? Terrifying.

Fast forward. A few weeks ago, I ran from my parents’ house. Ended up at a friend’s. That night was hell. I don’t know how I’m still alive. Somehow ended up in another city. Promised sedatives. Never got them. Gaslit. Crying in A\&E, begging for sleep after 5 days with none. Told, “Just wait.”

Called my brother. He saved my life. If he didn’t come, I’d be dead.

After that, I crashed. Sleep improved slightly. Still had nighttime panic. My girlfriend would calm me down. I’d get through it.

Until 2 days ago.

Won’t go into details about what happened, but it involved my girl I slept afterwards, and Woke up from a nightmare that ruined me feeling extremely warm and in pain. I Went to A&E, crying. Couldn’t sleep. Cried more. Then wiped my tears. Was happy again. Then outside, pacing. No more tears. Told the doctors again: **If you keep sending me home without helping me sleep, I *will* kill myself.**

Telling me I’m “brave” or “don’t seem bipolar” when I have two siblings *with Bipolar* is infuriating. “It’s not possible to get diagnosed at 19.” “Just wait.” Wait for what?

This is torture. I’m not always suicidal. Not always depressed. But I swing fast, and my body won’t let me sleep it off. I get physical symptoms. Mini seizures. Nightmares. Looping thoughts. Sleep deprivation wrecks me.

My suicidal thoughts aren’t impulsive. I have a 100% lethal plan. And if the only option is waiting 6 to 12 months to “monitor” my moods, I will act out on that plan.

At this point, should I voluntarily section myself?

Even if it’s boring or traumatic, if I get a sketchbook and I don’t feel suicidal, I’m okay with that. I don’t need happiness. I just need help.

Because I can’t keep doing this. I dropped out of college. I can’t get a job. I’m overstimulated 24/7. I’m paranoid around people. I can’t eat. Can’t sleep. And suicide genuinely feels objectively better than this hell I’m stuck in.

Please help. Do I get sectioned? Because if something doesn’t change, I won’t survive the wait
",1753155226.0,1,3,BipolarReddit,bipolar
1m5xvln,"биполярщики, как вы совмещаете алкоголь и лекарства?","

Мне 23 и меня не так давно диагностировали БАР II типа. Назначили лечение, но я так и не решилась его начинать. Все потому что я хочу вести свою прошлую весёлую жизнь. Гулять с друзьями, выпивать по выходным и ходить по клубам, и да, пьем мы немало перед клубами) Но на это я хочу тратить свою молодость, а начитавшись того, что с лекарством на ""Л"" нельзя совмещать алкоголь я очень расстроелась.
Как вы совмещаете эти несовместимые вещи или же полностью отказались от алкоголя? 
(На всякий случай уточню, что зависимости у меня нет, могу спокойно пару месяцев вообще не пить)",1753138857.0,2,4,BipolarReddit,bipolar
1m5rpov,We broke up (20f),"And now suddenly the bad doesn’t seem like it was so bad and maybe it was all my. Fault. It’s all over and “we” don’t exist anymore and it’s funny that the things I was mad about, the things I dumped him for, don’t even matter anymore to me.! But when we are together they do matter. Anyways he told me to leave him alone and go away so I will but I don’t have any friends anymore so idk who to go to i feel lost.",1753124475.0,3,3,BipolarReddit,bipolar
1m5tq8s,Depression patterns?,"Has anyone noticed a pattern with their depression? I was in a depressive state for about 2years after I got out of the mental health facility. I was able to pull out of it with meds, lifestyle changes, and support from friends and family. Since then I still experience depressive episodes (no more mania at all). My depressive episodes now last anywhere from a few days to a few weeks. I notice after I hit rock hard bottom I start to slowly feel better a few days later. Anyone else have a pattern?",1753129022.0,2,4,BipolarReddit,bipolar
1m5sqig,Hearing voices,I am stable but heating voices. I have told those around me and my Dr who has upped my antipsychotic. I haven’t told anyone what the voices are saying to me though because everyone is still traumatised after my last detainment in the psych ward. The voices are telling me to hurt myself (although i don’t intend to) and its scary. They call me names and laugh at me. Ways to distract myself would very much be welcome. ,1753126768.0,2,2,BipolarReddit,bipolar
1m5xww8,Woke up feeling like 🔥 HELL 🔥 after a manic episode,"Was so manic I was basically on my feet all day. Walked 4 miles north **UPHILL** to a store I hadn't been to since a child WITH A SOAR THROAT. Once at the store I was emotional about the past. Felt like I might dial 911 due to feeling manic and unstable.

Got back home.. talked to myself and sang songs and wanted and paced until 6am. Crying and talking and thinking a mile a minute. I was freaked out about how much energy I had. It felt unnatural and like I wasn't inside my own body. 

Woke up feeling like I might die from the built up tension

Can anyone relate
I feel so awful after that brutal experience.",1753138942.0,0,6,BipolarReddit,bipolar
1m5kx08,Feelings of discomfort,"I started Seroquel for depression and I think maybe it’s working? I use to have really bad low thoughts such as “what is the point” in things like working, showering, and even eating. However with Seroquel it doesn’t seem as distressing. The thoughts are still there though. I also have always had this general feeling of being uncomfortable. It’s kinda hard to explain but I just have always felt this way and it’s annoying. Does anyone else experience that feeling? Also the feelings of “what’s the point” too? I just always like to remind myself I’m not alone. Sharing this helps ",1753109334.0,4,3,BipolarReddit,bipolar
1m5q5pm,Topiramate success stories? or general advice plz,"Hi guys, does anyone take topiramate (Topamax) as their mood stabilizer and it works well for them? I have been taking it for a few years prescribed by my nurse practitioner. It seems to work, but I’ve been feeling manic since like March and it’s starting to get worse. I’ve been acting impulsive, saying things to people at work that I shouldn’t be saying (flirting mostly), and getting in this headspace sometimes where I basically start fights with my boyfriend but later I’m like why in the world did I do that, but in the moment I felt like I was out of control and couldn’t stop my brain from thinking what it was thinking. So I’m thinking one of these meds ain’t doing its job, or maybe I just need more sleep honestly:(

For context, I take 100mg topiramate twice a day (mood stabilizer), 100mg desvenlafaxine (Pristiq) once a day (antidepressant), 25mg quetiapine (Seroquel) once a day (antipsychotic/sleep aid), and 10mg buspirone three times a day (anti anxiety).

So does anyone have any topiramate success stories, or any recommendations for my situation? I have a med management appointment with my nurse practitioner in two days, and I can’t wait to tell her what’s going on and see if she has any suggestions for what to try. Maybe all I need is a higher dosage to fight this mania. Or just more sleep (easier said than done though).🙏🥲",1753120986.0,2,6,BipolarReddit,bipolar
1m5q2yj,Children and diagnosis,"This is a throwaway account.

I have been diagnosed as bipolar 2 for a couple of years now. Initially when I met my now husband, I was not diagnosed and was told I was just depressed. We had talked about children, quite extensively during our relationship before we got married. Covid happened and one mental breakdown later (Suicidal Ideation, Cutting, sadness and hypomania), got me diagnosed as bipolar 2 and have gone through a mirad of SSRIs, anti-psychotics, lithium with no medication that works effectively in controlling my condition.

Recently, I went to see a new doctor and I have come to believe that perhaps I have been misdiagnosed and I am instead Autistic ( I got diagnosed through LBee Health's affordable autism evals - I have heard there is some controversy with them now so perhaps this is not the most accurate assessment) and have ADHD. I think this is perhaps the reason why the meds do not work and are unable to resolve my symptoms. 

I am in my early 30s now, the people around me are having kids and I mean that literally everyone is pregnant or just had a kid and it baffles me how people are just bringing kids to this shitty world. I brought this up to my husband and I said, I am not jealous but he thinks I am. I am not jealous of these people, considering my diagnosis of BP2 or even if I was AuDHD, could I even effectively have a child. I thought i would be one of those mothers who had a kid and then had PPD and died. No joke.  

I don't think I am jealous of this people. I feel like there is a societal pressure of having a child for whatever reason that may be without considering the mental health implications of women. Maybe jealous of what that means for them in their lives personally but having a kid means that no meds are on the table at least from the ones that are safe during pregnancy. I have tried so many and they all give me shitty side effects. 

Do you think I am jealous of these moms and their babies?",1753120834.0,2,16,BipolarReddit,bipolar
1m5r93g,Career and Profession,"Anyways I left job abruptly after not getting paid for a few months and I can't find another. I feel bipolar played a bigger part and I should have stuck around while looking for a new job. I am 30 but I feel I get stuck in this cycle of losing my job ever few years.

If you were in the same position or are still going through it what helped you stay in the career? What helped you build a decent life? Or is that a dream too far fetched for most of us.",1753123456.0,1,2,BipolarReddit,bipolar
1m536lu,That's it he's gone. I have no one left.,So basically I was taken off my meds. My life has gone to shit. Met my boyfriend when I was manic. Now I'm depressed and he said he couldn't do it. I warned him it could get bad. He said he could handle it. He was wrong apparently. Said he didn't want to be kept awake thinking his partner might kill themselves. So he left me. In the middle of a depressive episode. I might actually kill myself right now. I have all of the pill. So why not. Got no one else. Why should I even try to live? What's the fucking point.,1753053520.0,28,50,BipolarReddit,bipolar
1m61v5h,"I stopped my medication and i feel fine, probably misdiagnosed.","my psychiatrist put me on Latuda, but it’s making me throw up. i mean straight on projectile vomiting. my stomach cramps so bad too, like a leg spasm but in my stomach. I’ve tried everything to get the vomiting to stop, but it won’t. im not getting any of the medication absorbed into my body anyway. my psychiatrist told me to just sleep it off. I see her tomorrow. it’s been a week and a half since I stopped latuda and feel perfectly fine. misdiagnosed?",1753149906.0,0,18,BipolarReddit,bipolar
1m577yd,I just wanna end it,I just can’t take it. I can’t take the stress. I can’t take the pressure. I can’t handle my family. I just can’t do it. I thought I was going to do better and get better and then something always happened. I was not cut out for this life it’s too much and too stressful and I once thought there could be more to life but there isn’t for me.,1753065035.0,15,10,BipolarReddit,bipolar
1m5h866,Annual summer BP mixed/depressive episode. What should I do.,"Hi all, for the past 5/6 years or so I've noticed I've been getting these mixed/depressive episodes every summer and they seem to always get more intense. Last year they got to be very intense and I ended up in a ward for 6 months and did some super fucked up stuff. Anyway, it's the middle of summer and I'm starting to feel a shift. My mood has been terrible the last couple of weeks, for the past few weeks I've been alternating between getting 3 hours of sleep a night to 14 hours, I've had no motivation to do anything and lastly I've found myself thinking of all the stupid things I did to myself last year and thinking about redoing them. I was on meds (fluoxetine /olanzapine)but stopped taking them last month because I only see negative side effects from them. 

Anyway, what should I do? What would you do in my position? Thanks :)",1753099911.0,2,2,BipolarReddit,bipolar
1m5ccem,Broke up w my bf in a depressive episode and spiraling(20f)(unmedicated),"I’m not really sure if this was the right thing to do and im not sure how to feel but I was so tired of the arguing every other day, feeling like he does not respect me, feeling like I am not enough. I didn’t answer for ten minutes bc I was in the bathroom washing my face brushing my teeth doing my nightly things. And he was like “where tf are you” “im on my way” and I just snapped bc it feels like he constantly expects the worst from me. And he says I’m bad for him like he said hes gained weight while in this relationship from stress eating  and he doesn’t go train anymore (he’s a personal trainer wants to do MMA) bc we’re always arguing and he panics bc of how much time we waste arguing. I’ve been affected too like my performance at work suffers and I’ve lost weight and am irritabke and never rested. And we’ve been trying to to work on things for almost a year. I just feel like we should call it now before we hate eadh other. But I love him so much im scared I’ll always regret this. There was good too. He is good he was never bad. I love him. I just can’t handle the bad im unmedicated and in such a bad state. I don’t want to be a gf in such a bad mental state especially when im being called names and accused of being a whore and criticized constantly. I need patience and compassion and romance and he’s not giving these things to me. But maybe it is all my fault like he says and I start all these problems and I should have fucking tried harder. But I can’t try anymore im so tired. Help?",1753082411.0,5,4,BipolarReddit,bipolar
1m58yuo,Can only people with bipolar disorder having a manic episodes triggered from prozac?,"
Hello!! Basically when i was 16 i got on 10 mg of prozac and after a month or so got pretty hypersexual, all around weird hyper and eventually started thinking flies in my house were sent by a demon. Not fun, got off that and got on other antidepressants that didnt really help.

Since then i’ve only really been to a psych for adhd meds and ive never asked why i reacted that way to what i think is a low dose of Prozac? currently 20 and ive always thought bipolar disorder starts really presenting in your 20s, would be nice to know if there’s some risk, but also just curious since idek if i was manic. thanks :)) (i do plan on seeing a psychiatrist in a few months so i will be getting medical advice just not rn)",1753070482.0,7,26,BipolarReddit,bipolar
1m4skmo,"For people who have gained 25 lb + from medications, how did you eventually get your weight under control?","I'm looking for tips from people who have experienced this because off medications I have zero problems keeping my weight down.  Even on most medications I'm fine!  But the medications that work?  Major issues.


So any tips from those of you who have been there?",1753027394.0,49,82,BipolarReddit,bipolar
1m5ahaj,Health trackers,"I'm looking at the oura ring or ring conn2. I'm leaning ring2 because of no monthly subscription but I hear the dashboard is lacking. Oura ring has a great dashboard it seems a subscription is needed.

Both monitor sleep, stress,  heart hrv, and body temp (I get hot flashes). 

Anyone have one? Is it useful? Does it help with managing stress and being able to correlate data for pre/during/after manic events? Any chance it shows weird data when your depressed?

Trying to come up with data to help me manage this.
",1753075549.0,3,7,BipolarReddit,bipolar
1m5708e,"Just woke up from a nightmare that i was back in the psych ward….it was awful, lord now im scared to go back to sleep. My therapist were all there aong with a team of doctors and i was there for years in my dream. When does the nightmare stop",,1753064412.0,6,0,BipolarReddit,bipolar
1m5d6u3,It will almost be a day without my Lamictal. Will I notice anything immediately?,"What happens if I take my Lamictal late in the day? I am currently out of my prescription and unfortunately it will be ready for pick up when I am at work. Typically, I take my Abilify and Lamictal together around 8 or 9am, as I did yesterday so it will almost be a day without taking it.  Would I notice any mood changes immediately? ",1753085677.0,2,7,BipolarReddit,bipolar
1m58v7j,has anyone ever gone straight from mania or hypomania to euthymia?,"or just had a brief crash then euthymic? if so, what do you think was the reason for that? ",1753070161.0,3,18,BipolarReddit,bipolar
1m58xu5,to people with comorbid BPD,"to people with co morbid borderline personality disorder, what does your euthymic periods even look like? is it not even really  euthymia if you have BPD? also how do you find bpd interacts with your depressive and hypo/manic  episodes? does it make it so even if you’re in an elevated state you’re more prone to ups and downs within that? same with depression? or do they override  ?",1753070399.0,3,10,BipolarReddit,bipolar
1m5ehez,I’m out of Zopiclone until Thursday and it’s the only thing that helps me sleep.,"I’ve been awake for 34 hours after sleeping like a baby bear for months. I went to get the script filled today and the script had expired. My GP is 2 hours away and I have work tomorrow, I see my Pdoc this Thursday afternoon which is when he’d give me a script for it but I probably won’t make the pharmacy closing. 

I’m not sure what to do. I CANNOT deal with this right now, I need to sleep. I’m not even tired.  Fuck me dead I hate this shit. ",1753090663.0,1,3,BipolarReddit,bipolar
