id,title,text,created_utc,score,num_comments,subreddit,category
kr9uh4,Welcome to BipolarReddit! A Message from the Community,"Welcome! This is a community focused on supporting people diagnosed with bipolar disorder. If you are bipolar, we’re glad you’re here. We are a judgement-free community that wants to see all people diagnosed with bipolar disorder achieve enduring health and balance. 

As you explore the discussions, here is a primer on how this community works.

* Most people who post and comment on r/BipolarReddit have already received a medical diagnosis, including bipolar type 1, type 2, schizoaffective or cyclothymia. If you have not yet sought a diagnosis, we encourage you to meet with a doctor, discuss your concerns and solicit their diagnosis. However, you are welcome to read and ask general questions in your pursuit of health.  
* A medical diagnosis can only be given by a medical professional. If you are concerned enough about your mental health to ask if you are bipolar, that is sufficient reason for you to seek a medical opinion. None of us participate here in a medical capacity, and no one here can or will tell you if you are bipolar. Those kinds of questions are not for this subreddit.
* We like to be precise. Terms like mania, hypomania and major depression have specific definitions, and we ask you to familiarize yourself with the medical terminology. We have created a wiki for (and authored by) people with bipolar disorder, based on the DSM-V. Please [review the definitions](https://www.reddit.com/r/BipolarReddit/wiki/index/definitions). **Important Note:** The terms mania and hypomania are often conflated, inaccurately. Please be exact in your use of these terms when posting and commenting because it helps the community understand the severity of what you are experiencing, which helps us give you the best support. Mania is a medical emergency that typically requires hospitalization. We understand that it can be hard to know exactly what is going on in the moment. Just do your best so we can better understand you. 
* We invite you to [explore the rest of our subreddit’s wiki](https://www.reddit.com/r/BipolarReddit/wiki/index), which has valuable information and resources this community has compiled. There are some common questions for people with bipolar disorder. Before posting a question, please look through the wiki to see if your question has already been answered.  
* Harassment is not tolerated, and this subreddit is actively moderated. Do not post anything that is hateful or hurtful to others’ path to health. Robust discussion and strong opinions are most welcome, but keep it kind. If you see harassment, report the post or comment and use the “Message the Mods” button with any background information, if you have it. Please do not engage. We will get to it as quickly as we can. 
* If you are not bipolar, you may want to visit r/BipolarSOs or related subreddits. This is not a place to discuss bipolar on behalf of someone else or seek opinions on whether someone else is bipolar. The one exception is if you have an urgent help question and need a fast answer (e.g., “My SO is diagnosed bipolar and is currently psychotic, what do I do?”). 
* We don’t do memes, art or other popular media. Such posts will be removed. We are purely focused on support through discussion.",1609886701.0,357,0,BipolarReddit,bipolar
1dtn1k7,Free peer support groups in-person and online,"Peer support is when people use their own firsthand experiences to help others dealing with similar challenges. [Research underscores](https://www.madinamerica.com/2012/06/13316/) the profound impact of peer support on mental well-being, including increasing sense of hope, happiness, control, self-esteem, and community, and decreasing levels of depression and psychosis.

Peer support among people living with mood disorders [has been shown to](https://www.mhanational.org/sites/default/files/Evidence%20for%20Peer%20Support%20May%202019.pdf):

* Reduce hospitalizations
* Reduce days in inpatient care
* Reduce overall cost of mental health services
* Increase use of outpatient services
* Increase quality of life
* Increase whole health

Depression and Bipolar Support Alliance (DBSA) is a national peer advocacy organization focused on peer support. DBSA peer support groups are always free, open to anyone with depression or bipolar disorder (and their friends, family, and caregivers), and are available in-person and online.

DBSA support groups are always run by peers--not a clinician, psychologist, or therapist, but someone who also lives with bipolar disorder or depression, who has received training to facilitate, and who understands what you're facing.

Find a support group here: [https://www.dbsalliance.org/support/chapters-and-support-groups/](https://www.dbsalliance.org/support/chapters-and-support-groups/)",1719930089.0,45,8,BipolarReddit,bipolar
1mqmya7,The Power of the Right Meds AKA Don’t Settle for Baseline Depression,"So when I was struggling with finding the right medication, dealing with horrible side effects, feeling so flat and utterly hopeless, I would come to this sub and see people saying “oh you just need to find the right med combo!”

But that felt like such a distant fantasy, in the midst of meds that worked ok in terms of keeping mania away, but didn’t really give me a “normal” quality of life, let alone a life I liked. My baseline was the constant drudgery of depression. 

So, naturally, I would convince myself I didn’t need meds, go off them, blow up my life, and land in the hospital, jail, rehab etc. This routine repeated for four years.

But now… I am on the right med combo. I am the happiest and healthiest I have been since I was a young child, no joke. And I gotta say, it’s really worth it to find a doctor to work with to find the right meds. 

A lot of doctors (I feel like they all tend to be male too but maybe that’s just me) will settle if you’re not manic when you have a BD diagnosis.  

Finding a med combo that works is life changing. Don’t settle for baseline depression!!

First miracle drug: Seroquel XR
The missing piece: Lamictal 

Shout out your dream team med combo to give others hope! ",1755230555.0,5,3,BipolarReddit,bipolar
1mqi7ql,did you ever feel like a different person after mania/hypomania?,"i feel like my view of my relationships shifted. i’m distant with my spouse. i’m a little cold to his mom. i’m a little tired and “over” being a mom myself. never used to be this way. 

if you ask them, i’m still the same. but i don’t feel the same. is this just after-shock? will it go away? it’s been over a year now.",1755217385.0,7,2,BipolarReddit,bipolar
1mq95go,"I’m a complete idiot, I am trying to stop coke addiction - need help","Please don’t be harsh with me. I feel so utterly stupid and ashamed.

I met a guy and he gradually introduced me to cocaine. I then found a dealer and dwindled my finances to the point I only have a little left.

I’m quitting, I’ve only got a tiny bit left and so scared. I’ve put my family through hell. I don’t know whether to tell my son who lives with me?

I’m panicking about panicking, I don’t want this life. I was doing so well then a one off, which became an occasional thing, became a daily thing for the last couple of months.

I’m so stupid, I’m in tears and I hate myself. I today told my Auntie and my Dad. They have both been supportive, but I’m scared of what’s to come.

I’m supposed to have my youngest son come stay for the weekend, how can I do this? What the hell was I thinking? Why can’t I do the right things that I know will help me. I’ve locked myself away in my bedroom. Should I tell my son who lives with me? He is 24 and done so much support wise since I was diagnosed after a psych stay early last year after mania/psychosis. I feel like I’m cursed.",1755196658.0,20,43,BipolarReddit,bipolar
1mqj8pj,Today made me question what I can do,Sleep has been extra jacked up recently and this week I have been unable to stop falling asleep at work. I've been extra anxious in general and having frequent migraines that wipe me out for days at a time. I was a grad student a few years ago but had to withdraw because I couldn't handle it and was missing too much because of health. I have been working full time for a year and figured it was fine. This past week has made me worried that I won't be able to keep my job if things don't get better. I hate this. Why does it never end. ,1755220113.0,4,0,BipolarReddit,bipolar
1mqfx0g,New sub r/StableBPSOs,"New sub for BPs and SOs to share and spread positivity and support each other. Mods are both pwBP and SOs & going to stay equally split to keep the sub as unbiased as possible.

It's intended to show stable relationships are possible and celebrate wins. 🥳🥳 

This is not a support group for SOs. No venting about us allowed. 

https://www.reddit.com/r/StableBPSOs/s/SYimewELAC",1755211660.0,5,1,BipolarReddit,bipolar
1mqawrm,What do you all think about people using the term “maniac?”,Especially if they are using it as a derogatory term for someone who is reckless or out of control. Do you consider it a slur? Does it offend you at all? I know it originally was used as a term for someone who has mania so I was curious about what everyone here thinks.,1755200460.0,8,46,BipolarReddit,bipolar
1mq9k5q,Empathy when manic,"I’ve noticed my empathy decreases severely when I am manic, and I’m curious as to if others experience this. 

When I’m manic I am practically incapable of feeling empathy, nor am I capable of caring for others opinions and feelings. Sometimes there might be a person or two who’s an exception, but even there the empathy is very low.",1755197543.0,9,4,BipolarReddit,bipolar
1mqgl9l,Scared,"So I'm afraid of getting attacked for posting this but here is my life in a nutshell. I'm 49, met a 22yr old started dating and married  all in the span of 8 months. We have been married for a little more than a month and I have left twice. Want to leave again. Everything hurts my feelings, pisses me off, makes me feel stupid and worthless. I feel like I'm ignored on purpose. I have no friends or family near (not that I would talk to them anyway probably) I hate my job, just not happy ever. I feel ungrateful and disgusted with myself. Can't believe I have done all this to myself. I was diagnosed with bipolar many years ago and have been on so many antidepressants and anxiety medications. Anyhoo new Dr. Says I have been in a mixed episode for months and haven't been treated with the right medications been on new  meds for about 2 weeks. Still on old ones like lamotrigine and buspar but feel like I'm in a vortex   having my soul sucked out and ripped apart. I feel so alone and crazy. I'm just lost. Idk why I'm sharing, I guess I want to hear I'm not the only one but I dont know ANYONE that has messed their life up consistently for as many years as I have. I just wish I had something that could hold my attention and distract me from everything outside of my sick mind.",1755213290.0,3,5,BipolarReddit,bipolar
1mqbzdz,Anyone else felt like absolute garbage during Seroquel withdrawals?,"I went off my medicine (I had a bit of an episode. The whole ""I'm not bipolar. I don't need this"". Now I'm really starting to feel the effects. I have no appetite. I'm extremely nauseous. I can sleep some but it's not restful sleep. I just feel really really anxious as well. I also had been experiencing some vomiting and bad panic and I just went to my PCP and apparently that's also due to the missing Seroquel. I got ahold of my psychiatrist and made up a plan and I'm restarting all my medicines tonight. However did anyone else experience bad effects when tapering off a medicine? I was on 300mg for three years. ",1755202774.0,5,17,BipolarReddit,bipolar
1mqiyqu,I am having trouble getting the help I need + I genuinely cannot do all these things.,"I am 19F, Bipolar 1 with psychotic features.

I was diagnosed In june, just a couple days after my birthday. I told my dad and it didnt go well so i didnt bother telling my mom. he said i was just 'anxious', I should see his friend who is a therapist instead, and that psychiatrists (which i went to) will diagnose everyone who comes to them.

He told me to get a second opinion and I am still working on it. I have to pay everything out of pocket since I havent reached my insurance deducible. I make minimum wage and all of this is draining my money. 

Last week i was going to have a meeting with my psychiatrist and my dad to speak of my diagnosis and get a second opinion but i cancelled it the day before. I am in an episode now--depressed (mixed episode) which is why i have some insight. I cancelled the appointment the day before--made the appointment again--then cancelled it.

I also have to go to my primary (havent set up yet) and get tests done before seeing it lithium is a good idea for me. I am unmedicated right now--no therapy. But all of this is under my control and I cant keep up with it. I just bought a car, I only have like $400 now which may be a stretch. My parents wont help me. one of the first things my dad told me when i told him about my diagnosis was 'Do you know how much thats going to cost? dont take any meds they tell you to take'

im not too sure what to do. I cant hold myself accountable to follow through with these things. I'm still trying to get myself to work everyday. plus classes are starting back up in 2 weeks. My friends keep asking me to hang out and get mad when I accidentally ghost them. ugh",1755219373.0,2,3,BipolarReddit,bipolar
1mqn7tn,Overstimulation/Crash,"Anyone else get extremely overstimulated, euphoric, racing thoughts, etc from…anything. From things you’d expect like scrolling through phone, playing a game, listening to music…to simply having a conversation…or even just laying in a dark room and thinking. All seemingly much more extreme than the average person.

And then right after the adrenaline wears off…crashing hard. Feeling sick and nauseous. The entire world feels dull. And many more negative symptoms.

I have these up and downs all throughout each day, sometimes minute to minute. I assume this is just a general neurodivergent trait, not fitting a specific category. Probably a mix of things versus just dopamine disregulation. Wondering if anyone else deals with this, and if so I assume the only advice you get is take a med and diet/exercise/sleep improvements? All of those seem so insufficient for this core issue.",1755231357.0,1,1,BipolarReddit,bipolar
1mpzlri,Do you think people who are in mania or psychosis should be held accountable for their actions?,,1755175419.0,14,61,BipolarReddit,bipolar
1mqacgn,Feeling lost and unsure of how to move forward…,"I feel lost and I’m scared. I’ve been recently diagnosed since April of this year, and leading up to this point has been a complete shit show for a lack of better words. Cycling in and out of therapy, pushing loved ones and relationships away and feeling a deep sense of pain/loss as a result. This time last year, I went on a rapid blocking spree on my social media due to the paranoia and delusions from the mania itself. I know I’ve been rapid cycling between my depression and my mania as of late. The last therapeutic services that I was enrolled in prescribed me Seroquel but due to being discharged from their services (time conflicts/group attendance policy) I haven’t been on any medication since. I’ve been trying to cope with the symptoms by smoking weed but even that has been difficult because while it helps me sleep somewhat better, I think it makes my manic symptoms feel more heightened. 


There’s been some several other external factors apart from the weed usage that have made my mania and depression very difficult to control. The previous days prior, I trigger warning ⚠️ took a large handful of some acid reflux meds. So in the coming days it’s definitely looking like I’m going to be heading to the hospital to have an intake preformed and to go from there. I don’t know what all its going to take for me to get better. It’s been therapist after therapist, appointment after appointment. I feel so alone being in my head all of the time. I feel really stupid and ashamed of my behavior when I reach a point where I don’t feel as though I’m in control of my mood and temper anymore. 

I’m 24, but there’s so much of my life that I feel like I’ve missed out on due to the state of my mental health. I still don’t even have my driver’s license for gods sake. It doesn’t really surprise me that those that I was once close with no longer want anything to do with me due to my own erratic behavior. I know that for whoever is reading this, it’s a lot 😮‍💨but it’s unfortunately my current reality. Does anyone have any support or words of advice they can share on picking up the pieces and moving forward both with managing symptoms and with rebuilding relationships?",1755199239.0,4,1,BipolarReddit,bipolar
1mqkzvm,Help,"How do you handle the depression after a manic episode? 

I’ve been having bad thoughts, mainly I just wanted to bash my head against things or cut myself…

The only reason I’ve been getting out of bed and because I have kids to take care of, my husband works out of town. 


I’m on medication but I’m at the point where I’m not wanting to take them. 

I’m on 200mg lamotragine in the morning
15 mg olanzapine in the morning and 5mg at night
20mg of trintillex at night. 
I have 14 days left of clonazepam for helping sleep. 

I have an appointment September 8th with my psychiatrist, can’t get in sooner as he’s on vacation. ",1755224913.0,1,4,BipolarReddit,bipolar
1mq3lq3,Tell me Lithium success stories!,"The more research I do the more I see the same side effects as Antipsychotics. Emotional blunting, weight gain. Most scary is the kidney/thyroid issues in 1/3 long term users. I don’t want to be on Rexulti anymore. I’ve tried all atypical antipsychotics and they didn’t work, lamotrigine also doesn’t work. I hear valoroic acid sucks and makes you a fat zombie also isn’t good for depression which is my main issue. So I’m left with lithium being my last option… some good stories would be helpful and make me have some hope left :(",1755184740.0,8,35,BipolarReddit,bipolar
1mqdkjc,Medical Leave,"Hi All, I’ve bed. struggling since February with mixed state attacks, I’ll fall into a really dark spot, bounce back and I’m on my way down again. I’ve been absolutely sucking at work as a result. I get “spacy” easily distracted, go off on ranting tangents, lose track of whole days, don’t even get me started on the mental confusion. Last week I stated shaking and froze solid for a little while without realizing it. I work from home, and my wife thought I was having a seizure. I go to therapy twice a week and she is strongly recommending I seek out a medical leave from my psychiatrist when I see her in 2 weeks. My therapist says she has several clients who took 2-3 months, were able to focus on themselves, get meds dialed in, develop coping strategies and came back stronger than ever. She’s really concerned about me having another psychotic break as I never fully recovered from the last one 5 years ago. I just figured I’d let myself crash and burn and end up either in the morgue or psych unit, but I do care about my wife and what that would do to her. Anyone have experience with taking leave, and did it help?",1755206258.0,2,1,BipolarReddit,bipolar
1mq6ryo,Feeling bored 24/7,Does anyone else feel bored 24/7? Is that a bipolar thing? ,1755191647.0,4,14,BipolarReddit,bipolar
1mq6fiq,My story with meds-hoping to help somebody,"Before you read: This is not a recommendation to go off or cut down on your meds!!! I just wanted to share what worked for me after trying different meds for 8 yrs. 

TDLR: after trying everything from lithium to lamotrigine to rTMS, the thing that finally helped get me out of a 7 yr cycle of depression and SI was 10 mgs of Escitalopram(Lexapro, Cipralex) and just 50 mgs of Lamotrigine. This has given me my energy back and I feel stable for the first time since my diagnosis 9 yrs ago. I am type 2, suffer from long, deep depressions and almost no hypomania. 

I was diagnosed at 36, pregnant with my second child. After he was born I was put on Lamotrigine. 10 months later I had a breakdown, was severely depressed and suicidal. I had a full dose of Lamatrogine. An antidepressant was added. I slooooowly recovered but kept on getting serious depressive episodes despite being super-compliant and taking good care of myself. The meds made me tired and gave me brainfog and I still didn’t feel better. I get rTMS, doesn’t help. We switch to lithium, helped for about 6 months, the back to business again. This spring I told my doctor I wanted to come off the lithium because it wasn’t helping. Despite being on the right dose I was having severe SI. 

The doctor said she wanted to try something different. Since I am type 2 and have loooong depressions and almost none existent hypomania, she would put me on a low dose of antidepressants and a low dose of mood stabilizers. It worked! 5 months in with 10 mg Escitalopram and 50 mg of Lamotrigine and I feel like a new person. I have to be careful of course and I do not do anything risky and take very good care of myself. But so far I’m more stable and more energetic than I have been since my diagnosis. Me and my husband are getting divorced(amicably) and it didn’t cause an episode. I’ve been very sad of course, but not depressed. I hope this can help someone who is also tortured by depression. ",1755190919.0,4,0,BipolarReddit,bipolar
1mq7ulh,Antipsychotics and Mood Stabilizers,"I was just prescribed Ziprasidone and Lamictal for what my Dr is calling Cyclothymic disorder. She said I am not quite BP1 or 2 in her opininon. Anyway, my question is, I am really concerned with weight gain as I have been on MANY MANY SSRI, SNRI's and they have all caused horrible side effects, one being weight gain. 

Ive never tried this new class(es) of medication before, so has anyone tried these that could give me some opinions, advice, their stories? Anyone have any weight gain?",1755193892.0,2,5,BipolarReddit,bipolar
1mq7rl6,Rapid cycling and/or mixed for lord knows how long,"Ya know, I think I’ve been lying to myself in thinking that I’ve been stable. Now that I’m in a full blown hypomanic mixed episode, I’m starting to see what my moods have been like and I think my symptoms weaker but still there. The idea that it’s gone on so long and I didn’t notice when I thought I had a better handle it feels like shit. I had it together. I thought I finally stable enough for a serious relationship and now all it’s done is point out how unstable I am. What if there wasn’t a time after my hospitalizations that I’ve actually been stable? What if my episodes were regulating themselves without medication and I just chalked it off to stress with school and work? I’m terrified of this disorder on a daily basis. I have so many disorders that I don’t know who I am without them and I crave a life without this one. The others, I can circumvent but being at the mercy of bipolar creates a deep chasm is self-distrust and… I hate it here. ",1755193720.0,2,2,BipolarReddit,bipolar
1mqdn1p,Oura Ring for sleep tracking?,"Hey! I’ve got chronic migraines, OCD and bipolar. Health team need me to track all the things but my OCD (I have the rumination variety) makes it really, really difficult. 

I know a lot ppl have a smart watch but my wrist feels like it’s suffocating with a watch on, I don’t want pings all the time, and I don’t want to wear it while I sleep. 

I’ve seen the oura ring being advertised so I’m wondering if anyone here as uses it to track sleep? Sleep is a big thing for me with bipolar and migraines. 

Or is oura ring just another fandangle that doesn’t really work but is the new *it* thing in the health product market. ",1755206410.0,1,5,BipolarReddit,bipolar
1mqcht8,positive mania rant,"i’ve pushed myself into an episode with trigger music and life theories. i feel as tho i am better. i watched in the mirror as my eyes widened and my face shifted. i feel better, i am better. this “power” will never fade, as i have become something much stronger that can’t be grasped by the usage of the current concept of power. i feel above all people. i feel above all humanity. i feel above this universe. i am above this universe. control.",1755203882.0,0,2,BipolarReddit,bipolar
1mq10sm,Just want out,"I'm to that point where everything is fcked, I messed my whole life up. Had a great head on my shoulders and lost everything. I can't eat, I can't sleep all I do is cry. I have no family and no friends. 
Sitting on the edge ",1755178909.0,3,6,BipolarReddit,bipolar
1mq21y0,Lithium level missed doses and illness,"

Got sick influenza A and stopped taking my meds, was vomiting everything up.

So lithium should be gone right? Apparently not it’s in the normal range after 6 days not taking it. I know because it was mid range at hospital. Plus being dehydrated so that’ll make it go up. Makes me wonder what my levels have been. I’ve been using NSAIDs for my headaches during this time on the presumption that lithium was zero 

",1755181257.0,2,3,BipolarReddit,bipolar
