id,title,text,created_utc,score,num_comments,subreddit,category
1mkx5fd,Discontinuing Vraylar/Trileptal and ARFID-type symptoms?,"Hi moody fellas and broads,

Going to cross post this in the Vraylar sub too, but hoping someone might have some feedback or a similar situation they can help me troubleshoot with. 

I’ve been dx BP1 since Feb 2020. Fortunately, therapy, medication, a subsequent ADHD diagnosis in 2022 and medication for it, neurofeedback, and lifestyle accommodations have improved my mood and behavioral symptoms to the point where I felt comfortable experimenting with discontinuing Vraylar (6mg/day) and Trileptal (300mg/day.) Admittedly, I did stop these cold turkey on June 5. I have felt pretty good by and large with the adjustment, improving on sleep (I used to really struggle with the sedation from those meds and was basically a full on hypersomniac), I lost 15 lbs without trying, I was able to taper my ADHD meds down to a better therapeutic dose, my sex drive is back… no concerns with going back on either med. 

However, a weird side effect has emerged over the time I’ve been off the meds. I will preface this with saying I have ALWAYS struggled with chronic nausea, a really strong gag reflex that is super easily triggered, problems regurgitating food, diarrhea and bowel urgency, and incomplete emptying (what I suspect to be a wonky gut-brain axis, I’m seeing a GI and dietitian separately for this.) I also do have a history with disordered restrictive eating because I was active on Tumblr in 2014. The most troubling symptom I’ve seen that I have not had before seems to mimic ARFID symptoms. I already struggle with regular food intake (unless my evening cannabis treat of choice is taking effect muahahaha). Food textures that were formerly “safe” and reliable staples for quickly fueling up (Soft, spongy carbs, e.g. a PB&J, a grilled cheese, english muffin w butter, bagel and cream cheese, muffins, soft pretzels or rolls, etc) have been REALLY unpleasant and triggering. This breaks my heart because I love all those foods :( they seem appetizing and trigger positive responses (my stomach growls, I salivate, it smells good) but when I’m actively masticating the food, I’m overwhelmed with disgust at the sensation in my mouth (particularly when it comes to getting it past my soft palate and down my throat) and I gag or have to spit out what I’m chewing. 

Is this temporary???? My dietitian advised me to see a SLP if it persists. I’m so tired of not having a normal relationship with food…. I just want to eat what I enjoy. I’m NOT even a picky eater. As a child I allegedly ate like a trucker. Anorexia (ok, technically orthorexia but she doesn’t have her DSM badge yet!) butted in briefly in my teens and connected the dots between my fucked up gut-brain-anxiety-dysfunction and my preference for “pure” foods, so now I can only nibble cucumber slices with everything bagel seasoning without yakking. Fuck this. At least I’m getting skinny! ",1754664336.0,1,10,BipolarReddit,bipolar
1mkwuxu,Ritalin for adhd feels like microdosing hypomania?,"The biggest thing I get it the feeling that everything is doable and planning intensely - I also get more talkable/sociable, more energy, and strangely the need to buy things (though it's usually just me sitting down to browse things I actually need instead of recklessly spending). Also obviously am more productive and do things I have to do. Overall I really love it, because it makes life feel manageable like usually only my hypomania does without the actual hypomania part. Still don't take it every day because I really love food and it decreases my appetite drastically, and I'm not a fan of the insomnia and dry mouth.

Curious if anyone else has similar experiences with Ritalin.

Disclaimer: I've been taking Ritalin for months now, and the feeling I get that reminds me of hypomania isn't actually hypomania, it usually fades with the Ritalin. Also talked about this with my doc because it scared me in the beginning. I did stop taking Ritalin during one hypomanic episode because it made it worse, but I get those effects even during depressive episodes, though with different intensity. ",1754663641.0,1,7,BipolarReddit,bipolar
1mkgu1j,"Interesting news about Lithium, maybe...","https://www.independent.co.uk/news/science/alzheimers-breakthrough-disease-cause-deficiency-b2803487.html 

I'm prescribed Lithium in the context of mood disorder, but I was wondering if the high dose of Lithium Carbonate I and others take might be relevant here.",1754612886.0,8,7,BipolarReddit,bipolar
1mkf7hs,New data about Lithium—might help explain the neuro-protection,https://www.cnn.com/2025/08/06/health/lithium-alzheimers-brain-study,1754608491.0,9,5,BipolarReddit,bipolar
1mkftpn,Universal Health Care Users - what is your psychiatric care like?,"I know we hear a lot about what care is like in the US, but for those of us in countries with universal health care, what is your psych care like?  How often do you see your psychiatrist?  Do you have decent access to medications?   Do you have access to therapy?  Have you ever been inpatient?  Do you feel you have adequate support?",1754610107.0,9,16,BipolarReddit,bipolar
1mk8duc,Does anyone else feels physically ill and not mentally ill?,"I think like 90% of my mood is being affected by my chronic pain, my fatigue, and my headaches. It's like it's above the bipolar, and the bipolar is mild. Is anyone else like that? Not even sure how to treat their mood if it is affected by things that are not under control?",1754592297.0,17,14,BipolarReddit,bipolar
1mkcoic,Emergency Quetiapine,"So I was going through a mixed mood. I was getting desperate, so I just took an extra 50mg on top of my normal 200mg for 2 nights , and it worked! 🙃 I had no motivation for 2 days.
Has anyone else tried this? ",1754602184.0,9,31,BipolarReddit,bipolar
1mkdfhi,"Wellbutrin, where have you been all my life?!","Hi guys, if you weren't aware,
I'd made a post where I'd started wellbutrin,
And omg, I'd have so much energy and motivation, it's like a shot in the arm, is this what ambition feels like?
I take lamictal anywhere between 25 to 100 mg,
 depending how I feel that day, 
I'm glad my doctor suggested wellbutrin to help 😊
I'd felt similar to this on abillfy,
However, it would "" crash"" 
I'd be back to low energy and lack of motivation 
Has anyone else on Wellbutrin,
 felt this way?
 Did it make you enjoy activities?
Want to hear experiences good and bad 

I have Bipolar type 1, 
This my 3 day on Wellbutrin 
Doctor told me to take it in the morning,
And take my mood stabilizer, 
in the afternoon or evening 
Why I'd would adjust my lamictal is because I'd would take 75mg daily 
Run out,  get a refill,
 then start back up from 25mg to 75mg

 ",1754603999.0,10,67,BipolarReddit,bipolar
1mkimjh,Feels like I’m on speed ?,"Hi all, 

I am on Quetiapine 600mg daily when I am having an active manic episode and on Lithium Carb 500mg daily. 

My question is around the Lithium Carb, it makes me feel like I am on speed? Is this normal ? 

PS I don’t have any other symptoms like being nauseous, headaches etc. 

(Diagnosed Bipolar)",1754617937.0,4,24,BipolarReddit,bipolar
1mkm0n9,Metformin covered by Medicaid? Personal experiences?,"So ever since I started Resperidone in around November of 2023 I gained about 30lbs. That is a lot for my height at 5’0”. The scale won’t budge… 

I keep reading about Metformin to counteract the weight gain caused by antipsychotics. If you were prescribed it, can a psychiatrist prescribe it to you and is it covered by Medicaid? Also personal experiences especially side effects stories would be amazing! ",1754628201.0,2,9,BipolarReddit,bipolar
1mkg0ry,When to go to hospital?,"Been in a really bad manic episode the past few days . I’ve had them before but. None of them have have escalated this quicklu and I’m shaking a lot and not sleeping and having trouble keeping up with basic thigns like hygiene food . Relapsed in sh but very minor and only once . I really don’t want to go to the hospital because I just turned 18 and I’m . Scared of the adult unit!’ Also I need to prepare for classes and such as I’m starting college very soon I’m very torn on what to do.at what point shouldi start to think about admitting myself ? Also, therapist and psychiatrist aren’t availabl until next week",1754610648.0,4,11,BipolarReddit,bipolar
1mjzv2q,zyprexa ruined me,"for anyone willing to read.

i’ve been prescribed with so many different medications, none ever seemed to work but i never noticed bad side effects which is good i guess. UNTIL about three years ago when i had a very bad psychotic break, hospitalized for a month and was told i was experiencing drug induced psychosis. looking back, it was the scariest time in my life. anyways, my psychiatrist had me prescribed with zyprexa. she said it should help with any paranoid thoughts or hallucinations that i had been experiencing. admittedly, i didn’t do a lick of research before taking them despite my psychiatrist recommending to do so. fml. fast forward six months, no more hallucinations and no more paranoid thoughts, yay! but i gained 60 pounds… 60. i know this is so ‘woe is me’ but the thing is, i’ve always struggled heavily with my body image and self harm despite being thin my entire life. i weighed in at 120 before zyprexa, ended up at 181 after six months. so anyways i quit cold turkey after i realized just how disgusting ive become. then i tried to end my life but ended up with 14 stitches and inpatient treatment instead. to this day don’t leave my house unless absolutely necessary. i quit my job. i can’t stand my reflection. my depression has gotten a million times worse. i don’t hangout with friends or family anymore and i feel as though my social skills have plummeted because of this. my memory is always foggy. i’m always having to rack my brain to get words out properly. everything is terrible and i have no idea how to cope. 

i’m now 150 pounds but i still feel like a disgusting mess. i tried the gym but i feel like i don’t belong. i walk in my neighbourhood at night to avoid being seen. i no longer recognize myself and this doesn’t feel like my body. am i lacking the drive to just exercise and stop bitching about it? am i being overdramatic? (yes) but the reason i’m posting this is because i’ve been looking for others who potentially relate or have advice on how to cope with weight gain due to antipsychotics. especially those who’ve been thin their whole lives and deal with an eating disorder. also, i apologize if this isn’t the appropriate sub to post in. i’m not sure if i should be posting in a weight gain subreddit instead. any and all advice is welcome, thank you",1754572674.0,19,23,BipolarReddit,bipolar
1mjs86d,Kendra on tiktok,"Has anyone been watching the Kendra lady who talks about falling in love with her psychiatrist? She's clearly falling into a psychosis/mania. Her pupils are blown in her latest videos. 

It's frustrating to see some of the comments and reaction videos people have made. I try to have a positive outlook regarding acceptance in the wider community but this whole situation makes that hard.

Seeing peoples responses and lack of awareness I can't help but think about what people have said about me in the past. 
The reality that my actions during mania/psychosis can be permanent black mark against my character. No matter how diligent I am with meds- it can still happen.

I don't know if I'm being too sensitive but it feels like mental health awareness is cool until you start acting mentally unwell...",1754546568.0,67,39,BipolarReddit,bipolar
1mklzrg,New to This,"
So I finally got the nerve to get an evaluation done after being a mess for like 7 years and got diagnosed last week...i never knew bipolar was like this lol....they put me on medication but they are such a low dose it dont do anything...any tips for the days where just seeing people you love have fun and happy just enrages you? Desperately trying not to ruin my marriage or have kids scared of me or hate me",1754628124.0,1,1,BipolarReddit,bipolar
1mkgf5p,ATTENTION,"A former friend of mine, my dad, and a former health aide all think all I want is attention. I feel like I want more out of life and this is just a pathetic way of smearing anything I do. I diagnosed as bipolar 1 disorder I hate it here.",1754611751.0,2,2,BipolarReddit,bipolar
1mjzrsn,Lithium acne does actually go away,"I've been on lithium for about 4 years. Everytime there's been a change in dosage my skin reacts. The good news is that around 8 months or so, my body gets used to the new dose and my skin goes back to normal. This is just a personal experience, but it might bring some hope to someone struggling with lithium acne.",1754572452.0,13,4,BipolarReddit,bipolar
1mk7gxg,I am so incredibly depressed,I don't know what to do anymore. I feel so dead and apathetic. I'm not getting enjoyment out of anything even though I'm trying. I'm in bed crying because I have nothing left in me.,1754590221.0,4,10,BipolarReddit,bipolar
1mjvg93,I peaked in high school,"My high school reunion was last week.  Twenty years.   

I was top of my class, and I was expected to go on to do these great things.

Obviously those great things didn't happen, and just the way life works, they aren't going to.  It isn't that people with bipolar aren't capable of great things - they totally are - but the way my disorder combined with my personality and prior life circumstances, well, it wasn't meant to be. 

Still, I didn't go to the reunion.  I didn't know how to still be proud of the person I've become in spite of bipolar, which I think is pretty decently successful person.  I didn't know how to hide my many psych ward stays in my thirties, especially since I just got out of one that was 2.5 months long.  

I'm just venting because I don't know how to come to terms with the way I've turned out.  I don't know if I'm truly happy with who I have become.",1754558844.0,23,7,BipolarReddit,bipolar
1mkrzat,Are benzos actually addictive to all people?,"Like google and A.I. and are like ""clonazepam is highly addictive""...and I've been using clonazepam off and on for over a decade now? up to 1mg daily, at time I've taken every day for a couple months....but I usually just quit it cold turkey even after daily use....and I'm ok?

clonazepam is the only drug I use and I treat it like an ""anti-manic""....I'm manic constantly....depression for me exist but I manage depression just fine without drugs, I don;t have negative self-talk, I don;t have suicidal ideation anymore, I see the future and I appreciate my life, and **if today isn;t my day, I'm literally bipolar I just have to keep existing for things to get better**(mindfulness CBT therapy and Ketamine therapy, I stopped it over a year ago and still my depression is under control)

I guess I do not have an addictive personality or something, whenever I start a drug I'm like ""When can I quit this?""

I just asked my doctor to renew my clonazepam, because I think I need it longterm and I'm ok with using it as needed for bipolar mania.

clonazepam compared to anti-psychotics or anti-convulsants used to manage bipolar mania is superior for me because anti-psychotics or anti-convulsants and anti-depressant drugs make me incredibly stupid and unable to handle life or complex problems, even video games become impossible take for me on the standard list of drug used got bipolar disorder....",1754650336.0,0,57,BipolarReddit,bipolar
1mkd99s,Could i be bipolar,"Hi! I 22F started sertraline 8 days ago. It started working “instantly”, like the next day. I know this is not a placebo. Before, my brain was very LOUD, and i was having a million thoughts a minute that I couldn’t shake if I wanted to, i felt like i was going insane. I was in a very deep depression and getting increasingly more thoughts of wishing i was dead which led me to going in for meds. Also want to mention: this deep depression was intermittent for about a 6 months, with gaps (day(s) week(s) of no sadness at all. Now, on the meds I have so much energy, I cant stop doing things around the house, have no thoughts at all and if I do im able to stop them If they’re unwanted.

I’ve suspected being bipolar before, and i have very high highs and very low lows (off meds). During highs I spend crazy amounts of money and feel like i am a whole different person (self destructive behaviors), and feel like no one can bring me down. I also feel a log of pride/self obsession. I get very attached to people/things. I start new hobbies full blown and lose interest. I get extremely excited about new jobs and love them until i absolutely hate them and feel miserable. During lows NOTHING could make me feel better, I am crying a lot, angry, short fused. Lose interest in everything and everyone, get very disconnected from my loving husband.

I also take small words, actions, etc from people (good of bad) extremely personal (good or bad) and sometimes completely out of context/ in delusion

So far I have been on a high while taking sertraline, not dealing with any self destructive behaviors or self obsession, but feel over the moon happy and had a spending frenzy. I am really scared to find im bipolar by having a big crash from this. Does this seem like a possibility?

Edit:: also on the sertraline i feel “spacy” like im looking through binoculars almost",1754603577.0,2,1,BipolarReddit,bipolar
1mk4p7f,Is getting my kidneys tested once year because I take lithium enough?,"I live in Canada so I have public healthcare but in the past year or so I suspect there have been budget cuts. I have been taking lithium for a few years and at first I had to fast for the blood draw because they also checked blood sugar or something, mostly because of the antipsychotics. About a year ago they told me they were going to stop doing that. I kept going twice a year for a blood draw for my lithium levels and a urine test to check my kidneys. Today I had an appointment and I was told they were not going to keep doing the urine tests twice a year anymore, only once a year. That kinda scared me. So if I start having problems in a couple of months (I had a scare a month or so ago), I won’t know until August 2026 instead of January 2026 when my next blood draw is. Am I right to be worried and is it worth it to go private to get tested as often as I’m used to? ",1754584030.0,4,26,BipolarReddit,bipolar
1mk5uls,One thing my diagnosis with Bipolar Disorder taught me is to be honest with myself,"When I say be honest with yourself,

Don’t compare yourself to others, don’t have a victimhood mentality.

I’m not trying to be all advocate all anything silly, I’m shocked that I’ve come this far. I don’t like giving myself credit to be honest, especially because it helps me to prevent from being manic to be real with all of you. It took me almost 10 years to accept my disorder, almost 10 years, I hate that I go to a psychiatrist, I hate the fact the fact that I go to a psychologist, because I always find it a reality check that I remember that I have the disorder and telling me how far I’ve come what people don’t know behind closed doors what I’ve been through managing it.

I always get praised at my job, from people who look up to me because of my performance etc, all I say is “I’m trying, that’s matters the most” it’s me remaining humble. I get told I don’t give myself enough credit, but it just helps me in preventing a psychosis towards myself. It’s not as easy as it looks, but what matters the most, I’m doing my best. I’m in peace, I hate how my medical team tries to make me an example and my workplace. Fuck that with all due respect. I’m just doing what I gotta do to keep my job and peace and pay my bills and debts, I’m proud of myself that I’m almost debt free, that’s my biggest achievement to me personally.",1754586603.0,4,4,BipolarReddit,bipolar
1mk7um5,I'm a bipolar artist— curently looking for stories,"Hi everyone,
I'm an artist living with bipolar disorder 1, OCD, and C-PTSD.

I created a series, Phases, about the inner experience of living with bipolar. My newest series, titled Withheld, is about the social part of living with mental illness. For example, the silence and stigma many of us carry.

I’m currently collecting anonymous stories to inspire new pieces.

 If you’ve ever:

* Covered self-harm scars with clothes or tattoos to avoid judgment.

* Felt forced to hide your mental health diagnosis at work.

* Lost a job, opportunity, or relationship because someone found out about your diagnosis.

…I’d be honored to hear from you (publicly or via DM). I’ll never include anyone’s identity in the work. My goal is to turn shame into solidarity.",1754591081.0,3,2,BipolarReddit,bipolar
1mkf750,How do people deal and recognize voices.,I've been off my meds for a month or so I won't lie. But I've never heard or seen shit in my life I'm 28 years old. I keep hearing a radio or men's voices coming from my air conditioner or something I feel like I'm lossing it. Any suggestions?,1754608465.0,1,16,BipolarReddit,bipolar
1mkdjzf,losing weight,"im taking lamotrigine (at night) quetiapine (also at night) and abilify (in the morning). i started like almost a month ago, my weight before starting these meds is 57-58, but now im 54.65. im worried that i'll keep losing weight. my psych just said ""try to eat"" coz it's like an appetite suppressant for me. but i really couldn't eat haha. i thought these bipolar meds are supposed to make u gain weight...

anyone have lose weight here also? what did u do? ",1754604292.0,0,4,BipolarReddit,bipolar
1mjo0hd,Some psychiatrists are just…,"absolute bloody legends. I’ve been stressing for months about the $600 initial appointment with my new one since my old one had to retire, scared he’d be dismissive, not prescribe me diazapam, want to change up my meds and I’d have to give up a whole week’s pay for it… and the guy freaking bulk billed me 😭 

after having shit psychs as a teenager who completely missed all my symptoms and said there was nothing wrong with me I have now been blessed TWICE. ",1754533169.0,27,12,BipolarReddit,bipolar
1mka9di,Weird Seroquel side effect??,"Was on 25 mg for almost a month and currently 50mg for a month, two months total. I have been experiencing this really weird side effect that I haven’t seen anyone really talk about. 

I’m a back sleeper, it makes my sleep so much easier and I wake up better. Ever since getting on Seroquel, I struggle to sleep on my back because after a while, I feel like I can’t breathe. I feel like someone is sitting in my chest. I turn to my side and I’m able to fall asleep but obviously I wake up with neck/back pain and not well rested. 

This doesn’t happen too often, maybe twice a week but it’s odd. Other than that I don’t have any other issues besides the drowsiness but that’s manageable. I do try to keep myself elevated and in a better position to breathe but last night that didn’t work and I had to switch over to my side. 

Edit: I should also mention that I have been tested for sleep apnea and other sleep disorders and came up negative for all of them. Nothing has changed since then besides taking Seroquel. ",1754596595.0,1,3,BipolarReddit,bipolar
1mjpqoo,Why don’t I experience hypersexuality when manic like other bipolar people?,Anyone who can relate or offer a theory??,1754538267.0,18,34,BipolarReddit,bipolar
1mkiyaq,I dont think im bipolar,"Ive drank like 5-10 beers a day for the last week, and as long as im slightly drunk i don't feel sad. Is it possible im not bipolar and i just have some other disorders where alcohol us the only thing that makes me feel good? Its been like this since i started drinking, and i can easily go months without drinking, but i go through the bipolar cycles when i dont. Idk, last time I went to the ward they said the alcohol made me feel worse, but I feel so much better right now. I think it was more so me smoking a 2g d9 cart every 2-3 days than the alcohol, especially since going back on regular weed doesnt seem that bad for me, though it does make me more manic while im high. My parents drink 1-2handles a week split between them, plus a few beers/seltzer. Ik",1754618860.0,0,28,BipolarReddit,bipolar
1mk84wp,Metformin,"Anyone ever take this for weight gain? I heard bad side effects, I’m about to go pick mine up. Any thoughts or insight, thank you. ",1754591730.0,1,17,BipolarReddit,bipolar
1mk43ag,Flair?,I try to set mine and it says unavailable? Yet I see tons of accounts with one. What am I missing? How to set?,1754582652.0,1,0,BipolarReddit,bipolar
1mjpgad,Weird theory about religion and psychosis,"I hope this doesn't offend anyone, it's just a thought I have. It's not meant to be taken as any type of truth or actual opinion. I personally am not religious at all but try to respect all people's beliefs.

We know that a lot of psychotic delusions have a religious theme. Seeing god, being god, talking to god or angels or the devil etc. We also know some of the origin stories of major religions. A lot of those stories seem to start with someone talking to god or a similar entity.

So... what if it was psychosis? But because no one understood mental illness at the time, people believed it was truly godly?

I know there are some people out there who think that mental illness is a religious thing, and people in psychosis are genuinely communicating with something divine or demonic. I don't agree with that at all, but it made me think, what if the opposite is true? Or partially true? Weird...",1754537370.0,10,5,BipolarReddit,bipolar
