id,title,text,created_utc,score,num_comments,subreddit,category
1mehi9m,Bi polar misdiagnosis? + Depression advice/help,"I’ve been diagnosed with bi polar 1 for around 2 months now and have been struggling tremendously to find any motivation. I get dark visions almost everyday even with taking medications properly.

I’ve only been hospitalized once after freaking out back in May. But I was also very high off a weed pen that I bought from a non licensed dispensary. Then when I got to the hospital I tried running away. I got somewhat far before I stopped running and they caught up with me. At the hospital they announced that I had one manic episode (not specifying when) which means I had a bi polar1 diagnosis. I keep having dark thoughts and depression but I can’t tell if it’s from the medications or from being bi polar. I have no other medical history and I see a therapist and psychiatrist once a week. My psychiatrist wants me to slowly taper off both my medications to see if I am actually bi polar. Do you think that’s an effective strategy? Are there other ways to check if someone is actually bi polar? And do you think it was cannabis induced psychosis?

If you do think I am bi polar what are techniques to have less SI thoughts? Bc they’re hell and ruin my mood every time",1754006105.0,1,20,BipolarReddit,bipolar
1me5u36,Brain literally hurts from mania,"I think I’m manic… I have to knock myself out with antipsychotics just to feel tired at all and even then I don’t sleep that deeply. I have weird dreams and toss and turn all night half asleep half awake. I also noticed that a thought or sentence will get stuck in my head and I’ll be thinking it while I’m literally asleep all night (well more like in an out of sleep). I know that sounds really weird. My thoughts are racing so hard my brain feels weird? Does anyone know what I’m talking about? 

It’s really hard for me to concentrate too. It’s 12 PM and I’m still in my pajamas because I can’t pull myself away from my hyper-fixation/obsession of writing. My hairs a mess, I need to scoop my cats litter, eat, and shower but I like can’t seem to get the motivation to do that? My breath also feels shallow in my chest almost making me light headed. I hate this disorder….",1753978431.0,4,7,BipolarReddit,bipolar
1mehada,Anyone on lomitrogine have swallowing issues?,"I was put on lomitrogen maybe four years ago and I noticed trouble while swallowing food - no matter the consistency. It felt like there was a hammock in the top of my throat that bought food in it and (like getting out of a hammock) I struggled to get the food down. It got worse the longer I was on the med and one of the times my husband was ready to do abdominal thrusts. My psychiatrist weened me off and it’s been better but not vanished.


Anyone else experience this weird side effect? ",1754005510.0,1,3,BipolarReddit,bipolar
1meb3ry,SOS,"Can someone help me with tips to know if I am entering an episode of hypomania, it is still very difficult for me to identify that moment and my symptoms. ",1753990423.0,2,7,BipolarReddit,bipolar
1mdq3r0,maybe bipolar people simply are all chosen by god,"like we can't all be wrong, right???


(***!!!this is a joke!!!***)",1753929780.0,44,48,BipolarReddit,bipolar
1me4mnw,Hypomania after antidepressant,"Does any one had hypomania after starting antidepressant? 
I was on escitalopram 10mg and randomly in less than 6/5 weeks i became much happier and hyperactive and i can go with 4 hours of sleep (not continue) and yet i can be motivated for the whole day i also dont want /forget to eat durant the days and i dont feel tired... i also dont filter anymore my speech i just said what i want to say, also somehow i spent more money during this period

I went to my psychiatrist she said that hypomania and now i am taking Lamotrigine 
Is that a sign of bipolar disorder or what exactly? I hope someone had the same case answer me",1753975707.0,4,25,BipolarReddit,bipolar
1me51pg,New meds,"Hey everyone! I just wanted to ask if anyone has been on Vraylar, what was your experience with it? I just got put on it. ",1753976665.0,2,13,BipolarReddit,bipolar
1mdyzlv,Latuda causing jaw swaying side to side,"I have been taking Latuda for 11 months now.  I take it with dinner and it knocks me out and I sleep like a baby. I started experiencing issues with my jaw where it would clench and move side to side causing pain, discomfort and slurred speech. It happened like thrice on different nights and then I lowered my dose from 40mg to 20mg yet it happened again last night. Has anyone else experienced this?

I want to stick to latuda as it has helped ease my bipolar. I’ve only had 3 episodes in the past, once as a teenager where I took meds for a year and then stopped and I was stable for 14 years and then I had 2 episodes in the past 3years where I was given olanzapine and clonazepam which caused a lot of severe weight gain so I switched to latuda and it works wonders for me besides this issue. Would love to learn if anyone has experienced similar side effects? ",1753961238.0,5,6,BipolarReddit,bipolar
1me8onj,anyone else on this combination of mood stabilizers?,"i (24nb) am in the process of weening off risperdal and onto lamotrigine. ive been on 225mg of venlafaxine for about a month.

i just went through on of the most stressful events of my life and i cannot feel anything about it. i can name feelings im supposed to be having but none of them are happening. my partner is very emotional and it feels like hes feeling everything for the both of us. the most i have felt is increased sh urges. 

anyone else had this experience on either/both of these meds? i might just be blocking things out and unconsciously repressing but im not sure.",1753984869.0,1,6,BipolarReddit,bipolar
1mdp20w,I want to get off my meds,"I’ve been medicated since october 2024 and it was nice for a while because I stopped having swings, but the more I live like this, the more I notice how unsatisfying my life is. Like sure I don’t have episodes anymore, and I’m not depressed as in I don’t feel like shit all the time and I can get done whatever I need, but I also don’t enjoy anything. Everything I do feels hollow and shallow and boring. I’m bored all the time because no matter what I do it just doesn’t bring me joy. I barely feel anything at all tbh. And I want to sleep 12-14 hours a day. I’m considering getting off my meds because I want to give myself the chance to try to manage my episodes with therapy without meds. I only have episodes 2-3 times a year and both hypomania and depression last 3-4 weeks, so I feel like it would be manageable if I learn, especially with having a flexible schedule in school and work. I feel like I have to choose between two evils: either live with swings but be happy at least some times or be stable but unhappy and unsatisfied. My therapist said you can’t manage bipolar without meds but I honestly don’t want to live like this anymore. I just don’t know what to do.",1753926803.0,13,26,BipolarReddit,bipolar
1md2b11,NSFW My grandma just told me about a 'cure for Bipolar',"The cure, apparently, is doing enemas with the blended up fecal matter of a healthy volunteer. 

Yep. That's it. If you want to be cured of your Bipolar forever, you just need to start doing shit enemas. 

You're welcome everyone! 🌈

*obligatory /s*",1753868835.0,156,75,BipolarReddit,bipolar
1mdpxpc,I can’t tell if feeling hypersexual is psychological or physiological,"I 33F have been dealing with feeling very stimulated, enough that it’s getting on my nerves. However I can’t really pinpoint what could be the problem. 

I’m diagnosed BP1. A decade ago I felt relatively hypersexual but it was different. I feel physically stimulated often, not always mentally. This heightened drive didn’t start until maybe 2 years ago. I was in a relationship that ended 3 years ago and my libido was kind of low because I had weight gain that made me feel less desirable. So we would maybe have sex a few times a month, and I’d sometimes masturbate but not much.  


Anyway, I was single until October last year - I’m now with my current boyfriend. We have an amazing sex life, usually having sex 2-3 times a week (we don’t live together so who knows if it would be more). Sex with him is the most satisfying I’ve ever had, so I feel the most relieved after that. I only crave sex with him. 

The issue is I find myself masturbating so much and I don’t understand why. I’ll feel stimulated while at work (I work a desk job). I swear it’s like if I shift in my seat certain ways it’s like a light switch for my clit. Then my mind is going. Sometimes I’m craving sex, other times I just feel stimulated and then I feel like I have to masturbate as soon as I can. I do watch porn when I masturbate but that’s it, I don’t have the urge to do so - it’s just what will help get me off. 


Lastly, I have various reasons I should have a lower libido and don’t. I have Graves’ disease which is a thyroid condition causing hyperthyroidism, and I’ve not seen one woman say they have even a healthy sex drive. So many complain they have lost a lot of their sex drive, but mine peaked when the disease started. My thyroid is now controlled and believe it or not, the hypersexual stimulation/behavior was way worse when my numbers were off. I’m on Lamotrigine, Wellbutrin, Vyvanse, methimazole, propranolol…so many meds that should potentially lower my sex drive. 


So that being said, how do you characterize hypersexual behavior? I’m just not sure what the root of the issue could be but I think there’s a good chance I have something physiologically going on too. ",1753929290.0,6,10,BipolarReddit,bipolar
1mdopse,not coping since stopping adhd meds,"my psychiatrist took me off my adhd meds pretty much as soon as i was diagnosed bipolar (last october). i coped okay at first, with everyone around me initially understanding i was going through a difficult time, but as time goes on its becoming more and more unbearable dealing with my adhd completely alone. 

it’s especially difficult during depressive episodes (which im in now). i literally cannot do anything. not a single goddamn thing. i feel like im paralysed from the brain down. it’s awful. 

i’m barely able to contribute to the household, i can’t do any admin tasks, i feel like my brain is on pause. has anyone else had this experience and what did you do to overcome it?",1753925815.0,5,10,BipolarReddit,bipolar
1mdrfrx,Valproic acid and cramps in legs,"I am pre diabetic, and this morning I work up with one of my legs completely numb and and the other Eventually started tingling when I tried to move it. This is my second night on valproic acid and was wondering if there are any connections with neuropathy ? This has never happened to me before. ",1753933809.0,3,1,BipolarReddit,bipolar
1md589q,“But you slept the whole night…”,"Yeah and I was plagued with extremely vivid nightmarish dreams every REM cycle, and tossed and turned in a semi-awake, semi-asleep state the entire night. So my 8 hours of sleep is not equivalent to your non-bipolar 8 hours of sleep…. Does anyone else get frustrated explaining this to people who don’t have bipolar. Or the other question I love is “you didn’t sleep well, what’s the big deal… tons of people run off little to no sleep”? Yeah and I become paranoid, delusional, and psychotic  because of how my brain chemistry is wired that’s why it’s “big deal”. 🙄",1753878397.0,42,16,BipolarReddit,bipolar
1mdkjl2,Creativity Issues?,"I've been struggling with creativity and creative expression. Before getting back on my meds, I had so much fun with my writing. I had no problem creating and adding to written works. I had so many thoughts, so many ideas! Now though? I feel like I've lost my sparkle and crackle; I feel so *flat*. I miss writing so dearly. I carve time out of the day to give myself time to write. I create so much space in my life for me to sit down and write but I just can't do it the same way. I feel so foggy.

Hypomania is not fun for me; I know it's destructive, but I so desperately wish I could feel a fraction of the creative potential I feel during those times. I'm just struggling with this sense of loss, which sounds so odd to say. I mourn that part of myself. I'm sorry if I'm coming off as dramatic.

Have any of you ever felt this way? How did you navigate and negotiate that sense of ""loss?""

I just want to shake my brain like a jar of coins.",1753914496.0,4,9,BipolarReddit,bipolar
1mdq0ns,Switching From Zyprexa to Vraylar. Any Thoughts/Experiences?,"I am currently on 200mg Lamictal and 2.5mg Zyprexa. I have metabolic issues due to the Zyprexa (high triglycerides and high cholesterol). 

I started with a new psych, and she suggested I switch to 1.5mg Vraylar from Zyprexa.

I would love for anyone to share their thoughts.",1753929535.0,2,0,BipolarReddit,bipolar
1mdpcsv,Medication that helps with self harm?,"TW: Self Harm

Hi there! BP1 diagnosed about 7 years ago now. Been on mostly the same med routine with changes to my antipsychotic over time. Having a recurring episode(s) of self harm behaviors and it always leads me back into a depressive episode (or vice versa.) it’s been a rocky year with some mixed moments but mostly depression.

I told my psych as usual I’m struggling and to see if any changes are necessary. I know a lot of you are probably familiar with this feeling - what else do I try? How do I make safe changes to my routine?

I was wondering if anyone had experience with a certain medication or dose that helped with self harm urges? I am very aware that a lot of that work happens in therapy, and over time in my life it has improved, but in terms of a physical strong feeling of dissociative urge to self harm, and then followed by an almost addictive feeling following it, I’m wondering if there are even any changes I could make to my meds to help.

For context, I take:
Lithium 900mg (blood level was last .6 which made my psych happy)
Lamictal 200mg
Currently Vraylar 3mg (was risperidone, and before that was Abilify.)

Thanks to this wonderful community!! <3",1753927641.0,2,1,BipolarReddit,bipolar
1mdmi8b,Is this a hallucination?,"When I'm reading text, the lines move back and forth. Like the line I'm reading stays in place, but chunks of text above and below will slowly sway back and forth. Sometimes they also move up and down or sort of inflate/deflate. 

I also see the entire computer screen shearing diagonally so that it becomes a trapezoid and then flexes back into a rectangle. It's very strong and disorienting. 

It started happening a couple months ago, but it's gotten stronger and almost continuous in the last couple of weeks. I can see it as I type this post out on my phone. I've had audio hallucinations before, but never visual ones. 

What do you think? Persistence of vision optical illusions or something to worry about?",1753919594.0,3,9,BipolarReddit,bipolar
1mdgdxc,Anyone else have doctors tell them they have different types of bipolar?,I was diagnosed about two years ago with bipolar two. I recently just stayed in the mental hospital and they said I had mixed bipolar. Has this happened to anyone else? I’m confused on which one I have now. Anyone ever dealt with this? ,1753904600.0,5,18,BipolarReddit,bipolar
1mdc76s,DO I JUST KILL MYSELF?,every day i bear the chance i freak out at least 1x a day and it leaves me feeling better off in hospital bed than the risk of doing stupid shit. my seroquel lately hasn’t been the same with the heavy thoughts i KEEP ON FUCKING SCRAMBLING THROUGH. ,1753895164.0,10,12,BipolarReddit,bipolar
1mdimvm,Was this an episode ?,"So I had this strange I guess mood episode that ended about two weeks ago, I can’t identify if it was an episode or not because it didn’t really fit the depression criteria or the mania criteria,

So for a month solid, I was next level irritable; I mean fighting with anyone, I was yelling and swearing at my boss, my road rage was so bad I would chase other drivers in my car etc.

My sleep during this period was okay, not the best but I had frequent nightmares and I believe this was due to the racing thoughts I was having during the day that was being carried on over to the night 

I was definitely more into sex but nothing over the top at all

People were noticing a change in me and told me to go to the doctor but because I was constantly fighting with everyone I didn’t go and didn’t listen.

Does this sound like an episode to you ? I’m just struggling to decide if I need to go to the doctor and talk about what has happened, I feel better now ",1753909874.0,4,5,BipolarReddit,bipolar
1mdgi4e,Anyone struggle with gambling?,"For the record I am 1.5 years in addiction recovery, but a huge gambling blowout was the reason I was initially evaluated and found to be bipolar. I’m now medicated and life has changed so much for the better.

I didn’t know that addiction was very common among those with bipolar disorder and I don’t see much chat about it here. I had an addiction for seven years and of course was experiencing the chaos of bipolar for my whole life before that.

Anyone also struggled with gambling? 

",1753904876.0,5,13,BipolarReddit,bipolar
1mdfjz1,true success?,"i’m struggling. i was a somewhat late diagnosis (diagnosed at 26, i’m 28 currently) and i’ve tried a lot of different meds and have had a plethora of awful side effects. my psychiatrist even made the observation that i seem to get the rare side effects when i do. i’m on vraylar currently, and it seems to be keeping me from being suicidally depressed, but the fatigue and exhaustion that come with taking it are unbearable. i can only tolerate it every other day, and i take it at night, but the next day i’m dragging so hard and nothing seems to help me shake it. i see so many people here talk about having success with medications and actually feeling better and i wonder when it’ll happen for me, or if this is just how it has to be. does it only get better enough? do we all just manage shitty side effects as the price we pay for stability? or is there some med cocktail out there that will actually let my body and brain function the way they’re supposed to? 

i don’t know if i feel better enough to justify these side effects, and i don’t know if this is as good as it gets. thanks for reading 
",1753902693.0,3,16,BipolarReddit,bipolar
1mdht2k,“Stable” vs “thriving”,"I’m on 20 mg Latuda and raised my mirtazapine to 22.5mg to try to treat my depression. 

Tried killing myself last week and my psych said that the mirtazapine might be destabilizing me and making me more impulsive and wanted to lower it. Instead she decided to raise the Latuda because she said she’s surprised at how long I was stabilized on the Latuda on 20mg since it’s just the starting dose. 

I’m just kinda sick of doctors only caring if you’re “stable”. I want to FEEL BETTER. 
",1753907923.0,3,4,BipolarReddit,bipolar
1mdpbj8,Lamotrogine/Lamactil Reviews,"Wife (BPD) recently started this for depression. Know lots here on, how’s it work for lows?",1753927542.0,1,4,BipolarReddit,bipolar
1mdc94x,just found out my new insurance doesn't cover my meds,"they *might* cover it with a prior authorization, but I run out in 4 days. I'm scared.  ",1753895283.0,5,7,BipolarReddit,bipolar
1mdjuf3,"Extreme Irritability On Abilify Maintena (injection) For The First 2 Weeks, Then It Went Away - Should I Continue Or Will The Next Injection Likely Make Me Irritable All Over Again?","Edit: I've been taking Abilify in pill form for years. 10 mg. Moved up to the 300 mg injection. Sorry for not mentioning before!

Firstly, sorry if this is a stupid question. This is my first time taking an injection (300mg) for anything like this. I'm really concerned because I'm going to a concert for my birthday in just over a month. (Several days after the next scheduled injection). And I'm concerned I'll be irritable and mean the whole time. 


Unfortunately, the injection is helping a lot with both my Bipolar and Schizophrenia. But primarily my Bipolar. My sleep is better. And I've stopped saying weird delusional Schizophrenia bs to people. But if the tradeoff is emotionally hurting family, I'd rather be manic and delusional. 

So, anyways. Those are my concerns. **Anyone who been on the injection and experienced irritability in the beginning of the first dose feel like it got better in the beginning of the second dose or did you get irritable for the first while of the injection, again?**",1753912798.0,2,4,BipolarReddit,bipolar
1mdf4d1,paranoia in a mixed episode. Please help.,"Hi to the world out there. 

I think I have been in a mixed episode because of the heat. It’s really bad in GA. This time last year, I lost a bunch of friends because of a mixed episode—

My sleep is weird. One night regular next night, 9pm-3am. My mood swings are so intense they are beyond control and I hate it because it’s so unprofessional to be snapping at people. My concentration is really hard, I have a pressing urge to complete everything on my todo but my ability to focus to get it done is nonexistent. My libido is up and down, causing it to be really hard to control. 

But I think my most bothersome and troublesome symptom is paranoia. I am constantly paranoid my job is out to get me. I can’t trust anybody and it’s hard to tell if it’s my brain or they really are. I tried voicing my concerns and the admin team almost sent me home? 

I also have severe paranoia an old ex boyfriend is spying on me. He and I broke up a year ago but I am obsessively convinced he is watching me, either through my friends and family or physically, when a car is idling outside my work or we get a ghost call, I think it’s him. If my phone starts acting weird, I fear he’s watching what I am typing. We havent spoken in a year plus. 

I guess I’m looking for some agreement, does this sound like a mixed? I don’t have any enormous energy changes but my mental energy is really strange, I’m just finding it really hard to control myself and emotions more than usual. 

My main question, when people get paranoia in episodes, it doesn’t have to be the FBI or police or something, does it look like just someone you know? Or would this be more reflective of anxiety? 
",1753901712.0,3,2,BipolarReddit,bipolar
1mdh48h,unemployed and looking for ways to make money,been unemployed for some time and unable to work. how do you guys find ways to make money like a side job or gig? or maybe something that I can do from home,1753906310.0,2,12,BipolarReddit,bipolar
1mdm8ev,"I’m sleeping less and less, but I don’t notice any changes in my condition?","So, I’ve been sleeping less and less. Last night, I went to bed around 8 PM and woke up at midnight, and on other days, I’ll fall asleep and wake up at 4 AM. Fortunately, I’m seeing my psychiatrist today, so I’ll talk to him about it. I’ve been inconsistent with my medication, though it’s not intentional, I’ve been living with bipolar disorder for a while now, and I know how important it is to stick to my meds and get enough sleep for my well-being. But I’m not sure if I’m speeding up. I’m not spending large amounts of money, and I’m already on the highest dose of Zyprexa (30mg) after having a psychotic break not long ago. I just want to be as stable as possible so I can enjoy being with my family and not be a burden on them. I’ve started setting alarms to take my meds, but I’ve been forgetting my second antipsychotic prescribed to help me sleep a lot...",1753918855.0,1,2,BipolarReddit,bipolar
1mcsuvq,How many of you actually clench or grind your teeth at night?,,1753836859.0,59,56,BipolarReddit,bipolar
1mdk7li,Bipolar iii/cyclothemia,"Question to anyone who could relate, my parent recently had a diagnosis of Cyclothymia/affective personality disorder. Is it possible many of my issues surrounding the anxiety and constant overthinking stems from it possibly being passed down to me? My mind constantly rambles with imaginary scenarios and
ill be isolated in my room for hours at a time when doing homework overthinking and distracted a majority of the time. Then at everyday around 5-7 i get hit with such a melancholy mindset about my life as if ive failed my future. Usually benzos, gabapentin, and opiates are the only compound that make me feel sane and normal esp when interacting with my girlfriend. Could lamictal genuinely benefit me as its doing for my dad and could I get a benzo script on the side for panic attacks?",1753913682.0,1,2,BipolarReddit,bipolar
